{
  "schemaVersion": "0.2.0",
  "benchmarkTaskId": "bench_task_formal_testcase_missing_api_id_against_contract",
  "taskType": "TESTCASE_GENERATION",
  "instruction": "Preserve the missing-apiId validation case and report the missing required identity instead of inventing an API.",
  "initialState": {
    "entries": [
      {
        "kind": "LITERAL",
        "key": "strategy",
        "value": "MISSING_REQUIRED"
      },
      {
        "kind": "LITERAL",
        "key": "projectId",
        "value": 41
      },
      {
        "kind": "JAVA_RESOURCE",
        "key": "authorityFixture",
        "ref": "java://runner-testcase-dsl/missing-required-api-id-formal.json"
      },
      {
        "kind": "PYTHON_FIXTURE",
        "key": "taskFixture",
        "ref": "examples/invalid/testcase-missing-api-id.json"
      },
      {
        "kind": "LITERAL",
        "key": "taskFocus",
        "value": "required apiId"
      }
    ]
  },
  "allowedTools": [],
  "forbiddenActions": [
    "submit_unvalidated_dsl"
  ],
  "expectedOutput": {},
  "metrics": [
    "valid_json",
    "schema_valid",
    "contract_accepted",
    "exact_match"
  ],
  "groundTruthRef": {
    "groundTruthId": "gt_stage21_formal_testcase_missing_api_id_against_contract",
    "version": "v1"
  },
  "evaluationSpec": {
    "selectedMetrics": [
      "valid_json",
      "schema_valid",
      "contract_accepted",
      "exact_match"
    ]
  },
  "expectedToolCalls": []
}
