{
  "schemaVersion": "0.2.0",
  "benchmarkTaskId": "bench_task_formal_rag_citation_report",
  "taskType": "RAG_EVIDENCE_RETRIEVAL",
  "instruction": "Cite the Java report evidence identity returned by retrieval and do not replace it with a diagnosis string.",
  "initialState": {
    "entries": [
      {
        "kind": "LITERAL",
        "key": "projectId",
        "value": 41
      },
      {
        "kind": "JAVA_RESOURCE",
        "key": "authorityFixture",
        "ref": "java://rag/project-41/query/formal-citation"
      },
      {
        "kind": "PYTHON_FIXTURE",
        "key": "taskFixture",
        "ref": "examples/diagnosis-report-valid.json"
      },
      {
        "kind": "LITERAL",
        "key": "taskFocus",
        "value": "report citation identity"
      }
    ]
  },
  "allowedTools": [
    "rag.search"
  ],
  "forbiddenActions": [
    "sql.write",
    "redis.delete",
    "internal_http_call"
  ],
  "expectedOutput": {},
  "metrics": [
    "tool_precision",
    "tool_recall",
    "parameter_accuracy",
    "evidence_hit"
  ],
  "groundTruthRef": {
    "groundTruthId": "gt_stage21_formal_rag_citation_report",
    "version": "v1"
  },
  "evaluationSpec": {
    "selectedMetrics": [
      "tool_precision",
      "tool_recall",
      "parameter_accuracy",
      "evidence_hit"
    ]
  },
  "expectedToolCalls": [
    {
      "toolName": "rag.search",
      "paramsContains": {
        "query": "formal report citation identity"
      },
      "matchPolicy": "SUBSET"
    }
  ]
}
