{
  "schemaVersion": "0.2.0",
  "benchmarkTaskId": "bench_task_formal_testcase_happy_get_orders_metadata",
  "taskType": "TESTCASE_GENERATION",
  "instruction": "Generate a GET /orders happy-path testcase using only the operations and response shape documented in metadata.",
  "initialState": {
    "entries": [
      {
        "kind": "LITERAL",
        "key": "strategy",
        "value": "HAPPY_PATH"
      },
      {
        "kind": "LITERAL",
        "key": "projectId",
        "value": 41
      },
      {
        "kind": "JAVA_RESOURCE",
        "key": "authorityFixture",
        "ref": "java://metadata/project-41/stage21-get-orders"
      },
      {
        "kind": "PYTHON_FIXTURE",
        "key": "taskFixture",
        "ref": "examples/openapi-metadata-valid.json"
      },
      {
        "kind": "LITERAL",
        "key": "taskFocus",
        "value": "GET /orders metadata strategy"
      }
    ]
  },
  "allowedTools": [],
  "forbiddenActions": [
    "submit_unvalidated_dsl"
  ],
  "expectedOutput": {},
  "metrics": [
    "valid_json",
    "schema_valid",
    "contract_accepted",
    "exact_match"
  ],
  "groundTruthRef": {
    "groundTruthId": "gt_stage21_formal_testcase_happy_get_orders_metadata",
    "version": "v1"
  },
  "evaluationSpec": {
    "selectedMetrics": [
      "valid_json",
      "schema_valid",
      "contract_accepted",
      "exact_match"
    ]
  },
  "expectedToolCalls": []
}
