{
  "schemaVersion": "0.2.0",
  "benchmarkTaskId": "bench_task_formal_testcase_get_orders_limit",
  "taskType": "TESTCASE_GENERATION",
  "instruction": "Generate a valid GET /orders testcase using the documented optional limit example; do not invent an undocumented parameter.",
  "initialState": {
    "entries": [
      {
        "kind": "LITERAL",
        "key": "strategy",
        "value": "HAPPY_PATH"
      },
      {
        "kind": "LITERAL",
        "key": "projectId",
        "value": 41
      },
      {
        "kind": "JAVA_RESOURCE",
        "key": "authorityFixture",
        "ref": "java://metadata/project-41/stage21-get-orders"
      },
      {
        "kind": "PYTHON_FIXTURE",
        "key": "taskFixture",
        "ref": "examples/openapi-metadata-valid.json"
      },
      {
        "kind": "LITERAL",
        "key": "taskFocus",
        "value": "GET /orders optional limit=10"
      }
    ]
  },
  "allowedTools": [],
  "forbiddenActions": [
    "submit_unvalidated_dsl"
  ],
  "expectedOutput": {},
  "metrics": [
    "valid_json",
    "schema_valid",
    "contract_accepted",
    "exact_match"
  ],
  "groundTruthRef": {
    "groundTruthId": "gt_stage21_formal_testcase_get_orders_limit",
    "version": "v1"
  },
  "evaluationSpec": {
    "selectedMetrics": [
      "valid_json",
      "schema_valid",
      "contract_accepted",
      "exact_match"
    ]
  },
  "expectedToolCalls": []
}
