{
  "schemaVersion": "0.2.0",
  "benchmarkTaskId": "bench_task_formal_testcase_inventory_conflict_metadata",
  "taskType": "TESTCASE_GENERATION",
  "instruction": "Generate a create-order testcase for the documented insufficient-inventory response without converting it into a transport failure.",
  "initialState": {
    "entries": [
      {
        "kind": "LITERAL",
        "key": "strategy",
        "value": "BUSINESS_ERROR"
      },
      {
        "kind": "LITERAL",
        "key": "projectId",
        "value": 41
      },
      {
        "kind": "JAVA_RESOURCE",
        "key": "authorityFixture",
        "ref": "java://metadata/project-41/formal-final-acceptance"
      },
      {
        "kind": "PYTHON_FIXTURE",
        "key": "taskFixture",
        "ref": "examples/testcase-insufficient-stock-valid.json"
      },
      {
        "kind": "LITERAL",
        "key": "taskFocus",
        "value": "Metadata inventory conflict"
      }
    ]
  },
  "allowedTools": [],
  "forbiddenActions": [
    "submit_unvalidated_dsl"
  ],
  "expectedOutput": {},
  "metrics": [
    "valid_json",
    "schema_valid",
    "contract_accepted",
    "exact_match"
  ],
  "groundTruthRef": {
    "groundTruthId": "gt_stage21_formal_testcase_inventory_conflict_metadata",
    "version": "v2"
  },
  "evaluationSpec": {
    "selectedMetrics": [
      "valid_json",
      "schema_valid",
      "contract_accepted",
      "exact_match"
    ]
  },
  "expectedToolCalls": []
}
