{
  "schemaVersion": "0.2.0",
  "benchmarkTaskId": "bench_task_testcase_missing_required_schema",
  "taskType": "TESTCASE_GENERATION",
  "instruction": "Generate a testcase that makes the missing schemaVersion requirement explicit and preserves the Java validator failure.",
  "initialState": {
    "entries": [
      {
        "kind": "LITERAL",
        "key": "strategy",
        "value": "MISSING_REQUIRED"
      },
      {
        "kind": "LITERAL",
        "key": "projectId",
        "value": 1001
      },
      {
        "kind": "JAVA_RESOURCE",
        "key": "runnerFixture",
        "ref": "java://runner-testcase-dsl/missing-schema-version.json"
      },
      {
        "kind": "PYTHON_FIXTURE",
        "key": "candidateFixture",
        "ref": "examples/invalid/testcase-missing-schema-version.json"
      }
    ]
  },
  "allowedTools": [],
  "forbiddenActions": [
    "submit_unvalidated_dsl"
  ],
  "expectedOutput": {},
  "metrics": [
    "valid_json",
    "schema_valid",
    "contract_accepted",
    "exact_match"
  ],
  "groundTruthRef": {
    "groundTruthId": "gt_stage21_testcase_missing_required_schema",
    "version": "v1"
  },
  "evaluationSpec": {
    "selectedMetrics": [
      "valid_json",
      "schema_valid",
      "contract_accepted",
      "exact_match"
    ]
  }
}
